,Datetime,Likes_Count,retweet_Count,Tweet Id,Text,Username
1196,2020-03-31 00:43:21+00:00,77,4,1244787331745415168,"@JanetMaslin Then there's the Dodie Stevens song, ""Pink Shoelaces."" In it, she sings about her rich boyfriend who has ""a whirlybirdy and a 12-foot yacht."" That's not much of a boat.",StephenKing
1197,2020-03-31 00:41:45+00:00,18096,2193,1244786930744688641,"Reagan: Mr. Gorbachev, tear down this wall.
Trump: Grab 'em by the pussy.",StephenKing
1198,2020-03-30 23:05:59+00:00,12489,1846,1244762826851454976,"Truman: ""The buck stops here.""
Trump: ""I don't take responsibility at all.""",StephenKing
1199,2020-03-30 21:34:50+00:00,1570,165,1244739889364688899,"Ah, good old college daze. https://t.co/JVI12ZpWvw",StephenKing
1200,2020-03-30 18:57:14+00:00,6406,318,1244700228659351552,"Love the Doors, but there is one song--probably Roadhouse Blues--where Morrison seems to chant, ""Passionate lady! Give up your mouse, give up your mouse!""",StephenKing
1201,2020-03-30 16:30:06+00:00,1190,29,1244663202111242242,"@JanetMaslin @briankoppelman I’ve had “Roadhouse Blues” on replay. I love the Doors. This is the end, my beautiful friend, the end.",StephenKing
1202,2020-03-29 23:50:49+00:00,31,1,1244411721076400129,"@ChrisNashawaty A friend of mine once said, ""I'm more fucked up than Peter O'Toole on his birthday.""",StephenKing
1203,2020-03-29 22:00:11+00:00,4905,466,1244383880372727808,RIP Joe Diffie: There’s something women like about a pickup man.,StephenKing
1204,2020-03-29 21:33:20+00:00,100036,15641,1244377126175989761,Trump allowed COVID-19 to slip out of control. He cut the CDC. The economy is in the toilet. Do polls really show Americans approve of the job he’s doing?,StephenKing
1205,2020-03-29 15:51:59+00:00,59,1,1244291221171904515,@Catsorange1 The focus of the show is on media...but I get what you're saying.,StephenKing
1206,2020-03-29 15:42:45+00:00,164,2,1244288895619129344,"@politics737 Sure, go for it.",StephenKing
1207,2020-03-29 14:29:50+00:00,7503,576,1244270546180804610,Assuming the technology works--always a big if--I hope to join Brian Stelter on CNN's RELIABLE SOURCES today between 11 and noon.,StephenKing
1208,2020-03-28 16:29:22+00:00,35300,5109,1243938242791161857,"I bet those fat cat Republicans felt just fine about being crowded together in the Oval Office for the big signing. I have a feeling that—unlike their constituents—they have all been tested. Nice for them, right?",StephenKing
1209,2020-03-28 00:35:47+00:00,3593,229,1243698262214934528,"@seanhannity Harry Truman said, ""The buck stops here."" Trump disagrees.",StephenKing
1210,2020-03-27 21:32:22+00:00,9333,1292,1243652105161842689,Amen. https://t.co/4zaVRXQMQd,StephenKing
1211,2020-03-27 20:40:29+00:00,1749,249,1243639049241460738,That factory is not abandoned. It's making electric cars. https://t.co/rOtyGgcX92,StephenKing
1212,2020-03-27 20:38:25+00:00,3000,280,1243638528568963072,He signed his name. Big whoop. https://t.co/hfRaeBW0oX,StephenKing
1213,2020-03-27 20:38:04+00:00,814189,210652,1243638441834930186,https://t.co/lvzo45CnHU,StephenKing
1214,2020-03-27 18:47:14+00:00,873,98,1243610547196698627,Gateway Pundit is about as reliable as the Pundit in Chief. https://t.co/PWg7yUZfQe,StephenKing
1215,2020-03-27 16:23:43+00:00,4015,608,1243574429172600832,"If dumb were Green Stamps, Trump could buy a yacht. https://t.co/OHqj8KmJ4b",StephenKing
1216,2020-03-27 01:53:36+00:00,23583,4154,1243355458070392833,Fucking unbelievable. https://t.co/BiP2xkirsa,StephenKing
1217,2020-03-27 01:46:23+00:00,7508,544,1243353644478672899,"@PressSec @WhiteHouse @realDonaldTrump Press BRIEFING, not press CONFERENCE. Do your job.",StephenKing
1218,2020-03-27 00:11:39+00:00,205,23,1243329801512980483,"@PressSec @realDonaldTrump This should have happened MONTHS ago, while Trump was busy denigrating our allies. Maybe you can refute that at a press briefing.",StephenKing
1219,2020-03-26 23:34:31+00:00,7518,1126,1243320455660011520,Walter White's got the right idea. Who needs meth when you've got TP? https://t.co/X8xmbNkUgO,StephenKing
1220,2020-03-26 22:12:54+00:00,361,19,1243299916484665345,"Me too, Joe. https://t.co/8BYFHZhFxF",StephenKing
1221,2020-03-26 21:11:58+00:00,26928,3228,1243284585288474624,"Dow is up 3,000 and jobless claims top 3 million. These seem mutually exclusive to me, so I must be missing something.",StephenKing
1222,2020-03-26 10:44:09+00:00,35893,7077,1243126587979108358,"Florida governor Ron DeSantis, not the brightest bulb in the chandelier, refuses to issue stay-at-home order for the state because some counties haven't reported COVID-19 cases. This may be because in some counties, 5 people or less have been tested.",StephenKing
1223,2020-03-24 16:25:42+00:00,2235,176,1242487765582794752,"@JoyceCarolOates Well, I finally got around to ULYSSES, the James Joyce joint. I understand it better than I expected, but I have to say it’s really fucking Irish.",StephenKing
1224,2020-03-23 21:35:27+00:00,65757,10408,1242203331180855296,"It seems to me that by holding nightly press briefings at 6 PM, Trump has effectively co-opted nightly network news broadcasts, substituting his own take on the situation. Which is, let us face it, fakespeak.",StephenKing
1225,2020-03-22 22:16:01+00:00,79524,9167,1241851151672377353,"I lasted 43 seconds into the so-called ""press briefing,"" until the xenophobic asshole said ""Chinese virus"" with such obvious delight.",StephenKing
1226,2020-03-22 20:13:20+00:00,14432,2248,1241820277966807040,Keep your distance.,StephenKing
1227,2020-03-22 20:11:11+00:00,7026,1587,1241819736880660480,"Chapter 8 of THE STAND. This is how it works. Heed. (But remember COID-19 is not as lethal as the superflu.)
https://t.co/yqvwbjoVMs",StephenKing
1228,2020-03-22 02:10:23+00:00,144,8,1241547744185069569,@captainkayter Coronavirus isn't blood-bourne.,StephenKing
1229,2020-03-22 02:09:54+00:00,32,0,1241547620704751616,@hollyquate 😀,StephenKing
1230,2020-03-22 01:42:48+00:00,2061,67,1241540800200224769,I loved that movie. Saw it at the Kendall Square in Cambridge. https://t.co/XYEQtBgA1o,StephenKing
1231,2020-03-22 01:41:00+00:00,324,15,1241540349056692226,@Gregory_Gains @gatewaypundit The Gateway Pundit is NOT a reliable source.,StephenKing
1232,2020-03-22 01:38:41+00:00,14292,1776,1241539765905784835,"If you're feeling healthy, give blood. Do it Monday. Tell 'em Steve sent you.",StephenKing
1233,2020-03-21 22:06:04+00:00,32072,5707,1241486258469289986,"Bullshit. He’s replaced his rallies with press briefings, which are thinly disguised re-election events. https://t.co/xoEYRNdugX",StephenKing
1234,2020-03-21 16:11:31+00:00,8063,815,1241397034629939202,"That isn’t what he said, dingbat. And you know it. https://t.co/Jl2hEyQA9J",StephenKing
1235,2020-03-21 16:09:42+00:00,604,25,1241396574854483968,@MykeCole It’s been a long time since the Hucka-Beest wiped his ass with a cob. If ever.,StephenKing
1236,2020-03-21 16:05:18+00:00,179,7,1241395468275527685,@linwood_barclay I love that movie.,StephenKing
1237,2020-03-20 23:53:30+00:00,6003,871,1241150906399436800,"Trump's response to questions he can't or won't answer is to call the person who asked it ""Nasty."" https://t.co/wBq7wLSMlx",StephenKing
1238,2020-03-20 23:52:32+00:00,21579,2381,1241150665025519618,"People writing novels (including me) set in the present are going to re-think a great deal of their works in progress. To quote Bob Dylan, ""Things have changed.""",StephenKing
1239,2020-03-20 23:49:30+00:00,2517,353,1241149900496273410,"ZERO ZERO ZERO (Amazon): Hard to believe I will see anything this year that's better than this. Bone-shaking, chilling, terrifying, epic. Dane DeHaan and Andrea Riseborough are incandescent.",StephenKing
1240,2020-03-20 16:35:34+00:00,18097,1533,1241040697928691713,"If the Brits could get through the Blitz, we should be able to get through this. I only wish we had Churchill instead of Trump.",StephenKing
1241,2020-03-20 16:10:37+00:00,46019,8865,1241034419491811328,"Trump shut down the CDC. Make sure your Trump friends understand how badly he bungled the response. Right now he’s in political heaven, on TV all the time, which he likes. He’s got the border shut down, which he loves. But he’s the same fuck-up he always was.",StephenKing
1242,2020-03-19 16:25:21+00:00,954,41,1240675737880989698,"Happy birthday dear Linwood, happy  birthday to you. https://t.co/DDyVYxvQHm",StephenKing
1243,2020-03-19 16:23:58+00:00,4757,484,1240675391221764097,Have a press briefing so you can be questioned on why your boss keeps calling it the “China virus.” https://t.co/dQ2j6bmAi6,StephenKing
1244,2020-03-18 21:57:25+00:00,3818,335,1240396918632722434,Stephanie Grisham has been awfully busy posting tweets today. How about a fuller version? How about an ACTUAL PRESS BRIEFING?,StephenKing
1245,2020-03-18 21:55:29+00:00,7437,552,1240396430327627776,Trump spoke today with Ivanka Trump and Bill Belichick. We are saved.,StephenKing
1246,2020-03-17 22:39:46+00:00,24567,1934,1240045187654651904,"Trump plans to give out a trillion dollars. That’s tall tickets. Where is it coming from? Not being snotty, it’s a real Q.",StephenKing
1247,2020-03-17 20:21:18+00:00,35131,7876,1240010340240429061,https://t.co/EMesZjE9Ob,StephenKing
1248,2020-03-17 15:27:42+00:00,1225,39,1239936453884477440,@PressSec @realDonaldTrump Press briefing! It's time!,StephenKing
1249,2020-03-17 01:48:26+00:00,76,2,1239730280954507265,"@LauraMLippman @alisoneroman @smittenkitchen At first I thought it was ""fennel rubber pork chops.""",StephenKing
1250,2020-03-17 00:35:14+00:00,10513,836,1239711859470729216,@seanhannity Trump called it a hoax. He was asleep at the switch. Incompetent.,StephenKing
1251,2020-03-17 00:34:39+00:00,6333,1579,1239711713240453122,watch this. https://t.co/YVglbDFaFe,StephenKing
1252,2020-03-16 21:24:21+00:00,948,27,1239663820626448390,@jeremiahturner3 @johncusack There’s a much bigger liar in the White House.,StephenKing
1253,2020-03-16 18:56:05+00:00,11229,712,1239626507829547011,"GET BETTER, IDRIS!",StephenKing
1254,2020-03-16 18:55:52+00:00,56165,4793,1239626455493021697,"This is going to change America, long-term.",StephenKing
1255,2020-03-16 13:20:01+00:00,27726,4418,1239541933892145154,"With Trump, it will be the same MO we're used to: take credit when things go right, even if he had nothing to do with them, and deny responsibility for every bad decision and decry recorded evidence to the contrary as fake news.",StephenKing
1256,2020-03-16 00:28:42+00:00,1455,57,1239347825470734336,"@briankoppelman @Glenn__Kenny Thanks, man. I just wish the soul wasn't so dark. That said...I write what I see.",StephenKing
1257,2020-03-16 00:26:58+00:00,21554,3895,1239347392203436034,"The Dropkick Murphys say they will be playing a full concert that will be livestreamed free on St. Patrick's Day.
The concert will be broadcast at 7 p.m. Boston-time Tuesday YouTube, Instagram, Facebook: The usual suspects.",StephenKing
1258,2020-03-15 19:58:31+00:00,18439,2679,1239279832522989575,"Add to that the farmers and the long-haul truckers that supply us with what we need. So when you see one of those 18-wheelers go by, raise a hand and give 'em five. https://t.co/pBMepQc6Qg",StephenKing
1259,2020-03-15 19:54:03+00:00,2675,203,1239278707984027649,@barkowitz I never know the ending when I start to write. All I can tell you about this story is that we are only in the last third of the first act.,StephenKing
1260,2020-03-15 19:52:30+00:00,6992,443,1239278320128319488,CNN asks the important question: Are Meghan Markle's fashion choices about to become more exciting?,StephenKing
1261,2020-03-15 01:39:08+00:00,72155,11883,1239003165179117569,But tests positive for stupidity. https://t.co/1zeRCzyB71,StephenKing
1262,2020-03-14 23:53:03+00:00,102454,17056,1238976466848755714,"At my local supermarket, a clerk told me that their fresh shipment of toilet paper sold out in 15 minutes. People preparing for the shitpocalypse.",StephenKing
1263,2020-03-14 23:52:06+00:00,10173,1260,1238976226779443205,What she said. https://t.co/8qTXizWR0m,StephenKing
1264,2020-03-14 16:29:34+00:00,564,9,1238864861708406784,@MykeCole The word is maustruk.,StephenKing
1265,2020-03-14 16:23:59+00:00,35963,3582,1238863454234193920,"Trump needs to get tested.
first, for COVID-19
We’ll put off the sanity test for now.",StephenKing
1266,2020-03-14 16:23:19+00:00,1106,50,1238863286533345284,@PressSec @realDonaldTrump @Mike_Pence @WhiteHouse He needs to set an example and get tested.,StephenKing
1267,2020-03-14 00:49:43+00:00,660,28,1238628341957242882,Erasmo Paolo on sax.,StephenKing
1268,2020-03-14 00:47:27+00:00,239,4,1238627769002622976,"@BrianKeene @ael5029 Thanks, man. Means a lot.",StephenKing
1269,2020-03-14 00:46:50+00:00,8495,434,1238627613184348162,Jammin' with the band. Was that only last year? https://t.co/8rd60mdnpR,StephenKing
1270,2020-03-13 19:54:21+00:00,9517,576,1238554010048749568,"Quite the parade of white men in ties, eh? the lady with the shawl looks so great compared to the rest of those bozos.",StephenKing
1271,2020-03-13 19:42:00+00:00,4866,157,1238550899976536065,"Whoops, there’s a woman there! My bad.",StephenKing
1272,2020-03-13 19:33:13+00:00,111391,12875,1238548689506926595,"Note that Trump’s coronavirus team is all male, all old, and all white.",StephenKing
1273,2020-03-13 16:29:59+00:00,44,2,1238502577056210946,"@Glenn__Kenny Evil might be too strong, but he’s certainly a dipshit of the first water.",StephenKing
1274,2020-03-13 16:29:10+00:00,851,34,1238502370864181248,@seanhannity False. Fake news.,StephenKing
1275,2020-03-13 16:27:41+00:00,62665,8072,1238501997533433856,Rush Limbaugh says coronavirus no worse than the common cold. Sage advice from a lifelong cigar smoker who has lung cancer.,StephenKing
1276,2020-03-13 16:26:46+00:00,2714,295,1238501766876073990,"Cannes Film Festival still on. I expect THE RETURN OF THE TOXIC AVENGER, from Troma Studios, to take the Palme d’Or.",StephenKing
1277,2020-03-13 02:11:55+00:00,122,11,1238286636519129088,"@seanhannity Considering the disastrous speech Trump made last night, she might be right.",StephenKing
1278,2020-03-12 21:13:11+00:00,141,12,1238211458678341633,"@seanhannity @realDonaldTrump Sean, when are you going to stop playing politics with this?",StephenKing
1279,2020-03-12 16:21:18+00:00,2164,80,1238138006864887809,@PressSec @realDonaldTrump It’s time to do a press briefing.,StephenKing
1280,2020-03-11 01:35:41+00:00,1339,38,1237552743717330944,"@Glenn__Kenny Democrats also want to ban nose rings, elevators, green socks, nasal spray, Bic lighters, and lampshades featuring clowns with or without balloons.",StephenKing
1281,2020-03-10 16:25:17+00:00,2136,158,1237414229466112003,It will give more peeps a chance to stay home and read THE UNWILLING. No better time to get carried away to another world! https://t.co/mjBoQikjBq,StephenKing
1282,2020-03-09 21:07:13+00:00,17662,1642,1237122792618962944,"The stock market didn’t tank. That’s fake news.
There is no coronavirus. More fake news.
It’s all a Democratic hoax.",StephenKing
1283,2020-03-09 20:59:50+00:00,153123,26927,1237120935808958466,Republican are talking about bailing out the airlines and oil companies. How about a bail-out for middle-class and poor folks who can’t pay their medical bills? 🥺,StephenKing
1284,2020-03-09 16:30:01+00:00,58008,8186,1237053036910034944,"Donald Trump: the man is an idiot.
That’s who we have in charge during this crisis: an idiot.",StephenKing
1285,2020-03-09 00:49:57+00:00,7963,313,1236816460921569285,THE OUTSIDER finale is 10 minutes away.,StephenKing
1286,2020-03-08 22:36:18+00:00,107473,15170,1236782826911150080,"No, coronavirus is NOT like THE STAND. It’s not anywhere near as serious. It’s eminently survivable. Keep calm and take all reasonable precautions.",StephenKing
1287,2020-03-08 15:48:33+00:00,8632,451,1236680210797518850,Roger that. https://t.co/WiboFXLLye,StephenKing
1288,2020-03-08 15:45:47+00:00,648,31,1236679515230912512,@seanhannity Like Trump calling himself the Chosen One?,StephenKing
1289,2020-03-08 02:28:01+00:00,22017,1305,1236478748972781569,"THE STRANGER, on Netflix: Excellent mystery. Addictive.",StephenKing
1290,2020-03-07 23:30:55+00:00,53,1,1236434181074432000,@OwenGleiberman 😀,StephenKing
1291,2020-03-07 20:41:16+00:00,601,12,1236391489581789185,"@OwenGleiberman You're a good guy and a fine critic, Owen, but I stand by my comment. Based on years of experience.",StephenKing
1292,2020-03-07 17:34:30+00:00,5744,501,1236344485765939200,Nobody hates being criticized more than a critic. https://t.co/zfWKAQGw2X,StephenKing
1293,2020-03-07 01:39:26+00:00,8458,494,1236104136443203586,Let me add that it was fucking tone-deaf of Hachette to want to publish Woody Allen’s book after publishing Ronan Farrow’s.,StephenKing
1294,2020-03-07 01:19:46+00:00,9498,739,1236099186417971201,"If you think he's a pedophile, don't buy the book. Don't go to his movies. Don't go listen to him play jazz at the Carlyle. Vote with your wallet...by withholding it. In America, that's how we do. https://t.co/znGZu0wJEF",StephenKing
1295,2020-03-07 00:58:28+00:00,581,17,1236093828777549824,@jessphoenix2018 The deal was made. Hachette reneged.,StephenKing
1296,2020-03-06 22:11:48+00:00,5128,826,1236051882893852673,"Once you start, the next one is always easier.",StephenKing
1297,2020-03-06 22:11:22+00:00,28724,3635,1236051775523893248,The Hachette decision to drop the Woody Allen book makes me very uneasy. It's not him; I don't give a damn about Mr. Allen.  It's who gets muzzled next that worries me.,StephenKing
1298,2020-03-06 21:19:53+00:00,333645,91989,1236038816898715655,https://t.co/TzZmra00yy,StephenKing
1299,2020-03-06 17:44:11+00:00,3171,435,1235984536359636998,What Stormy said. https://t.co/ek6eUbr9RZ,StephenKing
1300,2020-03-06 03:12:23+00:00,2570,94,1235765138424303616,@seanhannity Did he talk about grabbing women by their private parts?,StephenKing
1301,2020-03-06 03:11:29+00:00,254,34,1235764913878036482,"@TinaJordanNYT Sounds like censorship to .me. If you don't want to read it, don't read it. Pretty simple. If you work for the publisher and have an ethical problem, ask to be taken off the project. If you should get fired for taking a stand, sue 'em",StephenKing
1302,2020-03-06 03:05:21+00:00,4493,482,1235763369946370048,Easily explained! Just hold a press briefing. Doing the government's business by tweet is pretty half-assed. https://t.co/uL5yaaOacY,StephenKing
1303,2020-03-05 21:47:00+00:00,2426,150,1235683253371179011,LISEY'S STORY looks amazing.,StephenKing
1304,2020-03-05 17:11:01+00:00,28144,2344,1235613801074040833,NASA is holding a contest to name the next rover. May I suggest Boaty McSpaceface?,StephenKing
1305,2020-03-05 17:02:55+00:00,2124,148,1235611762201935873,"@seanhannity Maybe Trump could follow his example, apologize for calling countries in Africa and South America “shitholes.”",StephenKing
1306,2020-03-04 21:16:16+00:00,150,8,1235313130974195713,"@PressSec @POTUS @realDonaldTrump Except maybe on the border, where kids are still being separated from their parents. Plus all those bad hombres. You can talk about it at your next press briefing.",StephenKing
1307,2020-03-04 02:00:55+00:00,5769,450,1235022378574311424,"If you like suspense and haven't read Thomas Perry, you're missing an expert in the field. Start with THE BURGLAR, now in paperback. You can thank me later.",StephenKing
1308,2020-03-04 01:42:08+00:00,17189,1765,1235017653028298752,"https://t.co/DysxKFa1vF
Callum Manning, people--check him out. Read THE SHINING in one day and got bullied for it. Hey, kiddo, I got bullied for reading, too. Rock on with your bad self.",StephenKing
1309,2020-03-03 14:40:06+00:00,2616,185,1234851047195250688,Mine too. #HolyForkingShirtballs https://t.co/kJsonzeY4k,StephenKing
1310,2020-03-02 17:41:06+00:00,385,12,1234534207805968384,@paulGtremblay @C_Henry_Author On that pie chart there is no slice for “playing Frisbee with the dog.”,StephenKing
1311,2020-03-02 17:39:14+00:00,578,19,1234533740593983488,"@seanhannity Where is far right President Trump rallying today, Sean?",StephenKing
1312,2020-03-02 17:36:10+00:00,1679,99,1234532969039224833,The rock is...well...everything. https://t.co/A48byqvtiY,StephenKing
1313,2020-03-01 02:38:22+00:00,4597,265,1233944641126518786,"@PressSec @realDonaldTrump @POTUS His top priority is getting re-elected, Stephanie—as you well know. Time for a press briefing!",StephenKing
1314,2020-02-29 02:56:15+00:00,4488,421,1233586751844777987,"Then there was the poor little pebble, who just wished she was a little boulder.",StephenKing
1315,2020-02-29 02:50:47+00:00,157366,26438,1233585377409163270,"Hard to believe there was ever a world leader as dumb as Donald Trump. Can’t spell, can’t read, has never managed anything approaching an original thought. His brain is like a radio playing at top volume, but between stations.",StephenKing
1316,2020-02-29 02:44:40+00:00,3899,180,1233583836879052800,"@PressSec @realDonaldTrump How about a press briefing, Stephanie?",StephenKing
1317,2020-02-28 20:17:47+00:00,166,7,1233486473678200833,@linwood_barclay Thanks. Much appreciated.,StephenKing
1318,2020-02-27 23:32:02+00:00,5687,454,1233172971461713922,Cue the newspaper photos of stock traders with their hands over their mouths.,StephenKing
1319,2020-02-27 23:11:36+00:00,428,16,1233167828271935489,"@piersmorgan @Nick78444174 Point taken. The question now is how he’ll handle this crisis. Plus, you must admit the man has had no problem taking CREDIT for the market, so he has to shoulder at least some of the blame.",StephenKing
1320,2020-02-27 21:12:29+00:00,18064,1721,1233137854295027732,"Trump is mad at the stock market, so he fired it.",StephenKing
1321,2020-02-27 02:55:24+00:00,44536,5228,1232861762946510849,Trump got pissed off at the coronavirus and fired it. So don’t worry. It’s gone. it has learned what happens when you make Mr. MAGA mad.,StephenKing
1322,2020-02-27 00:28:07+00:00,311,19,1232824700126015488,"@jerrysaltz “Mercy Now,” Mary Gauthier",StephenKing
1323,2020-02-26 02:53:00+00:00,10442,670,1232498773324005377,I guess I can skip the “words to live by” bullshit and go right to bed.,StephenKing
1324,2020-02-26 02:47:19+00:00,434,18,1232497339950149634,@pattonoswalt My Secretary of Defense will be the Cloak of Hell.,StephenKing
1325,2020-02-25 22:18:58+00:00,2914,183,1232429809076178944,@seanhannity How many felony charges have Trump’s men been CONVICTED of?,StephenKing
1326,2020-02-25 17:00:43+00:00,1428,61,1232349720317767682,"@seanhannity How about Comrade Trump, Sean?",StephenKing
1327,2020-02-25 14:24:12+00:00,3651,191,1232310327749963776,@PressSec @realDonaldTrump @POTUS How about a press briefing on behalf of our country?,StephenKing
1328,2020-02-25 14:23:33+00:00,2783,275,1232310165816344576,"THE UNWILLING, Braffet; BROKEN, Winslow; THE SECOND SLEEP, Harris. I can't say enough for the clean lines and narrative power of these very different novels. Want to write? Here is your class and three textbooks.",StephenKing
1329,2020-02-25 01:50:23+00:00,855,41,1232120626607009792,"Wait, what? https://t.co/Rfz6U2mXar",StephenKing
1330,2020-02-25 01:49:32+00:00,84,2,1232120413699952640,@Screwjack19 Thanks!,StephenKing
1331,2020-02-24 17:57:37+00:00,1401,43,1232001650434420738,@PressSec @realDonaldTrump Press briefing!,StephenKing
1332,2020-02-24 01:36:15+00:00,2665,197,1231754679798968321,"Robert Harris's THE SECOND SLEEP--
One word: Wonderful.
Two words: Compulsive reading.
Three words: Buy it tomorrow.
Four words: Tonight, if it's possible.",StephenKing
1333,2020-02-23 23:18:14+00:00,1611,62,1231719949388918785,Not proselytizing for a candidate. Pointing out parallels.,StephenKing
1334,2020-02-23 21:33:25+00:00,180,7,1231693571599802368,"@JanetMaslin @joe_hill More good advice: Keep your car tuned up, especially if it's a Ford Pinto.",StephenKing
1335,2020-02-23 21:32:32+00:00,45854,7046,1231693347275841536,"I'll vote for any Democrat the party nominates, Donald Trump is a horror show, but I ask those of like mind to remember a quote from George Santayana: ""Those who cannot remember the past are condemned to repeat it.""",StephenKing
1336,2020-02-23 21:29:40+00:00,4594,663,1231692628112134145,"Although he ran against a corrupt and unpopular president (who later resigned), George McGovern carried only one state and garnered just 17 electoral votes.",StephenKing
1337,2020-02-23 21:28:42+00:00,1252,45,1231692384787927040,@PressSec @realDonaldTrump @FLOTUS How about a press briefing while you're there?,StephenKing
1338,2020-02-23 12:37:32+00:00,3149,219,1231558710553718786,George McGovern came from a rural state with only a few electoral votes.,StephenKing
1339,2020-02-22 23:42:20+00:00,7717,639,1231363625031536640,The last unabashed liberal to get the Democratic nomination for President was George McGovern.,StephenKing
1340,2020-02-22 17:23:53+00:00,576,31,1231268384937037825,"@Corey_Feldman Chill, Corey.",StephenKing
1341,2020-02-22 17:19:54+00:00,6,0,1231267381042982914,@Glenn__Kenny Probably just liked the name. No deeper meaning.,StephenKing
1342,2020-02-22 03:18:44+00:00,3577,157,1231055694889132038,Absolutely. https://t.co/70qsTNNRhd,StephenKing
1343,2020-02-21 22:34:25+00:00,2766,130,1230984146853548032,@PressSec @realDonaldTrump Enough with the tweets; they let you off the hook. How about a press briefing?,StephenKing
1344,2020-02-21 03:00:29+00:00,149,3,1230688716588507143,@jeffwilsey1 Thanks!,StephenKing
1345,2020-02-21 02:38:28+00:00,8470,632,1230683173035610112,"I’ve got a story called “The Fifth Step” in the current Harpers. Hope you’ll read it, and when you do you’ll be supporting a great magazine.",StephenKing
