,Datetime,Likes_Count,retweet_Count,Tweet Id,Text,Username
3638,2016-10-17 11:26:06+00:00,23162,8937,787977986486263808,"If you're a man whose wife or daughters have been sexually harassed, and you're still planning to vote for Donald Trump, shame on you.",StephenKing
3639,2016-10-16 00:51:19+00:00,4457,1145,787455850466205696,"To slightly revise an old 1950s paperback cover: ""Trump has hit the gutter...and bounced lower.""",StephenKing
3640,2016-10-15 21:11:42+00:00,16578,3505,787400580037738497,"After celebrating her 2nd birthday by pounding a couple of 40s, Molly crashes on the bed, no doubt dreaming of chaos and anarchy. https://t.co/xlg94H5wZj",StephenKing
3641,2016-10-14 16:09:24+00:00,8066,2282,786962116267892737,"Suppose you were an idiot, and suppose you were Donald Trump? But I repeat myself. (Apologies to Mark Twain)",StephenKing
3642,2016-10-14 01:59:09+00:00,2217,361,786748143266299904,"The new issue of CEMETERY DANCE contains a new (and brilliant) short novel from Joe Hill. ""Snapshot 1988"" will blow your mind.",StephenKing
3643,2016-10-13 20:50:32+00:00,973,204,786670477406330882,"HEARTS IN SUSPENSION, coming soon from me &amp; others. University of Maine Press. Details here.
https://t.co/TU4b4o8VFa",StephenKing
3644,2016-10-13 18:21:03+00:00,45210,18698,786632860757360640,"Michelle Obama: “To dismiss this as everyday locker room talk is an insult to decent men everywhere."" Thank you for saying that.",StephenKing
3645,2016-10-13 16:17:06+00:00,12224,4402,786601665805901826,I am ecstatic that Bob Dylan has won the Nobel. A great and good thing in a season of sleaze and sadness.,StephenKing
3646,2016-10-12 22:21:50+00:00,30627,11057,786331066478977024,I can't wait for this ugly fucking presidential campaign to be over.,StephenKing
3647,2016-10-12 16:12:44+00:00,3085,631,786238179288358913,"Today's great country music title: ""She Got the Ring and I Got the Finger.""",StephenKing
3648,2016-10-11 16:19:36+00:00,13384,3024,785877518658121728,"Molly, aka the Thing of Evil, enjoys her usual breakfast of gin and juice while listening to Iron Maiden's Powerslave album. https://t.co/yYy8Jzx9zg",StephenKing
3649,2016-10-10 02:14:06+00:00,7471,2326,785302356892217345,Hillary is speaking in specifics. Donald is...well...fulminating.,StephenKing
3650,2016-10-10 02:11:38+00:00,8753,3170,785301733400510465,Trump is up past his bedtime.,StephenKing
3651,2016-10-10 02:06:47+00:00,9798,3577,785300514237976576,Trump looks like a big ole sulky baby. Do we need a big ole sulky baby as President?,StephenKing
3652,2016-10-09 00:00:13+00:00,1032,143,784906276635549696,That young woman can BRING IT.,StephenKing
3653,2016-10-08 23:59:56+00:00,1628,410,784906202350223360,I love PITCH. Kylie Bunbury is outstanding as Ginny Baker.,StephenKing
3654,2016-10-08 01:03:35+00:00,10713,3940,784559835329298432,"Hey, Donald! Did you kiss your mother with that mouth?",StephenKing
3655,2016-10-07 19:57:43+00:00,14574,7631,784482862003126272,Electing Donald Trump to fix America would be like fixing eczema with a blowtorch.,StephenKing
3656,2016-10-07 16:26:51+00:00,5288,1429,784429795014836224,"Repubs all hot to stop the drug epidemic, but they don't want to talk about how some folks want to get high because they have nothing else.",StephenKing
3657,2016-10-05 16:08:18+00:00,6285,2085,783700351815979008,"Trump's taxes made me think of a Travis Tritt song that goes, ""The fat man's busy dancing while the poor man pays the band.""",StephenKing
3658,2016-10-05 02:21:13+00:00,2470,587,783492207215009792,"Hey, whatever happened to polite Canadians?",StephenKing
3659,2016-10-05 01:32:34+00:00,2854,806,783479964368863232,"The Pence debate technique: If you don't like the question, like about Trump's taxes, don't answer it.",StephenKing
3660,2016-10-03 21:11:14+00:00,5402,697,783051809434763264,"Sad that Big Papi is retiring, but glad I'll get to see him against Cleveland. Still...end of an era, man. End of an era. https://t.co/QcAXLfsn5e",StephenKing
3661,2016-10-03 19:01:18+00:00,145,10,783019110020050945,@Breznican It's the partial remains of a billy bumbler from Mid-World.,StephenKing
3662,2016-10-03 19:00:41+00:00,13868,6546,783018957263568896,"Hey, guys, time to cool the clown hysteria--most of em are good, cheer up the kiddies, make people laugh.",StephenKing
3663,2016-10-02 13:41:36+00:00,37995,16414,782576266444759040,"The more I read about and listen to Donald Trump, the more appalled I am. Not as a Democrat; as a human being. A genuinely nasty man.",StephenKing
3664,2016-09-29 21:46:17+00:00,1543,266,781611078144954369,"Laura Lippman's latest novel, WILDE LAKE, is a knockout. You should get right on that.",StephenKing
3665,2016-09-29 10:43:48+00:00,2441,317,781444359535329280,"CAT'S EYE, on HBO this morning, made me remember that it was just the 2nd movie rated PG-13. The first was RED DAWN.",StephenKing
3666,2016-09-27 20:23:35+00:00,99,8,780865490080129024,@moosewill I think Molly has an evil twin!,StephenKing
3667,2016-09-27 16:49:52+00:00,9334,3687,780811707853701120,My favorite Trump button. Sent to me by Maine humorist Tim Sample. https://t.co/4iXgtAg7ay,StephenKing
3668,2016-09-27 10:55:25+00:00,9068,2838,780722506294501376,"Two candidates onstage last night at Hofstra: one prepared to be President, one prepared to go on Sean Hannity's radio show.",StephenKing
3669,2016-09-27 03:05:29+00:00,11502,2301,780604245229928448,"Molly, aka the Thing of Evil, preps for her job as moderator at the next Clinton-Trump debate. If anyone can make Trump shut up, it's Molly. https://t.co/GArJBSJp2K",StephenKing
3670,2016-09-27 01:50:48+00:00,5676,1713,780585451904196613,"""I have property there!"" This guy is off the wall.",StephenKing
3671,2016-09-27 01:28:27+00:00,8914,3229,780579827388743680,Hillary is wiping the floor with him.,StephenKing
3672,2016-09-26 10:59:30+00:00,2137,257,780361146142453760,THE GOOD WIFE: Peter Florrik goes from prison in Season 1 to governor in Season 5. Only believable because we're talking Chicago politics.,StephenKing
3673,2016-09-25 16:25:34+00:00,7574,2516,780080816630145024,"Texas may go for Trump, but they have a saying for guys like him: ""He's so low, he could put on a top-hat and crawl under a rattlesnake.""",StephenKing
3674,2016-09-25 01:43:19+00:00,2188,149,779858790124494849,Thanks to everybody who came out today in Washington DC. That was a damn good time.,StephenKing
3675,2016-09-21 17:10:04+00:00,2295,396,778642462759870465,Right?,StephenKing
3676,2016-09-21 17:09:57+00:00,5508,903,778642433957658624,"And when you turn 70, it's the law that they give you a parade and everything is free, right?",StephenKing
3677,2016-09-21 17:09:11+00:00,8643,1614,778642242357567488,"Thanks for all the happy birthday wishes, you guys. Getting old kinda sucks, but this makes it better. And hey, 69's the new 68!",StephenKing
3678,2016-09-20 16:29:17+00:00,4416,647,778269811910516736,"Prepping for the Red Sox-Orioles game tonight! Photo courtesy of Rich Chizmar. You should subscribe to CEMETERY DANCE, his mag. https://t.co/Ta9q2uWQek",StephenKing
3679,2016-09-20 00:38:43+00:00,1242,148,778030594374701061,Love Samantha Mathis in THE STRAIN. She kicks ass.,StephenKing
3680,2016-09-19 22:02:48+00:00,82,5,777991358048899072,"@Jerry_Remy We gotta get there first, Rem Dawg.",StephenKing
3681,2016-09-19 22:00:50+00:00,1438,293,777990860902367232,"Speaking of the good stuff, how about Mel Gibson in BLOOD FATHER? His best performance in years.",StephenKing
3682,2016-09-19 20:52:39+00:00,2227,568,777973701258125316,"Herman Koch is rapidly becoming one of my favorite writers. His 3 novels, taken together, are like a killer EP where every track kicks ass.",StephenKing
3683,2016-09-16 16:00:38+00:00,2453,367,776813051509141504,"I don't know about the chicken man in Philly, but the Red Sox certainly blew up the Yankees last night, and I loved it.",StephenKing
3684,2016-09-15 16:12:09+00:00,41,2,776453559915282432,@_DavidMorrell @BevVincent Congratulations!,StephenKing
3685,2016-09-15 02:41:14+00:00,43,2,776249487211782144,@linwood_barclay I can relate.,StephenKing
3686,2016-09-15 01:51:52+00:00,2559,690,776237063473664000,"Reliable sources on Cthulu's denail he is Trump: ""Well, it's what he WOULD say, isn't it?""",StephenKing
3687,2016-09-14 16:45:21+00:00,1192,293,776099529363972096,"If you don't know this little tune, give a listen. It'll cheer up your day.
https://t.co/wYCj0CM7nh",StephenKing
3688,2016-09-14 15:50:06+00:00,12859,4530,776085625514647552,"Molly, aka the Thing of Evil, demonstrates what the world will look like after 4 years of Trump foreign policy. https://t.co/He5Sl4RDfq",StephenKing
3689,2016-09-12 20:47:28+00:00,19690,9845,775435683368464388,Breaking News: Reliable sources reveal that Donald Trump is actually Cthulu. The absurd hairdo isn't absurd at all. It hides the tentacles.,StephenKing
3690,2016-09-10 02:49:23+00:00,315,42,774439599875710976,@CathyPegau @mharvey816 Are you SURE you're alone in your house?,StephenKing
3691,2016-09-10 02:47:53+00:00,1082,196,774439221411086336,"Congrats to Rick Porcello of the Red Sox, MLB's first 20-game winner.",StephenKing
3692,2016-09-10 02:43:45+00:00,8734,3294,774438181005656066,"I have a button that says CAN'T SLEEP, CLOWNS WILL EAT ME. Probably not true. But what if it was? What if they're just waiting?",StephenKing
3693,2016-09-09 16:32:48+00:00,115,19,774284432807256065,@EW @ChrisNashawaty You talkin' to me? Because I'm the only one here.,StephenKing
3694,2016-09-09 16:32:12+00:00,6498,1278,774284278834364418,"I'm going to see SULLY this weekend. After 10 months of Donald Trump, I'm desperate for a real American hero.",StephenKing
3695,2016-09-08 21:49:41+00:00,1766,297,774001788806660096,"I'm really sorry that TYRANT (FX) has been canceled. For 3 seasons it made sense of an insane situation, and in an entertaining way.",StephenKing
3696,2016-09-08 16:58:33+00:00,68,12,773928522490445824,"@Breznican Admit it, you want to see THE SNURKS.",StephenKing
3697,2016-09-08 16:57:52+00:00,8138,2478,773928351165800448,"Instead of holding Trump's feet to the fire, Matt Lauer seemed to warm his hands at The Donald's celebrity glow. A poor showing.",StephenKing
3698,2016-09-07 00:24:39+00:00,8053,1954,773316011147821061,Darrell in THE WALKING DEAD and Vasily Fet in THE STRAIN: The two coolest monster fighters on TV.,StephenKing
3699,2016-09-04 02:52:03+00:00,139,4,772265942415994885,@Lady_Trancy1 Happy Birthday!,StephenKing
3700,2016-09-04 02:30:52+00:00,11846,5315,772260611094962176,"Yep, I just keep coming up with funky ass shit every single day. I'm like Snoop that way.",StephenKing
3701,2016-09-04 02:19:13+00:00,7268,1546,772257681608470528,"Sitting here with the headphones cranked, listening to Grandmaster Flash and RUN-DMC. IMHO just the way to ride Saturday night.",StephenKing
3702,2016-08-27 20:33:00+00:00,12465,4216,769633838033231872,"Our governor, Paul LePage, is a bigot, a homophobe, and a racist. I think that about covers it.",StephenKing
3703,2016-08-27 01:10:50+00:00,10585,1724,769341366774206465,"Molly, 2014: The origin of evil. https://t.co/ZSlKM7uBdX",StephenKing
3704,2016-08-26 15:49:20+00:00,4925,778,769200063314857984,I like this time of year to go to the movies. Some interesting smaller films show up. Going to see DON'T BREATHE tonight.,StephenKing
3705,2016-08-26 02:41:14+00:00,672,124,769001728138149889,@FinnSkata You go with your bad self.,StephenKing
3706,2016-08-26 02:39:44+00:00,66,8,769001353364537344,@Kimberl94097790 Hmmm...maybe 7 or 8.,StephenKing
3707,2016-08-26 00:30:50+00:00,66,6,768968915775004672,"@marykarrlit Amen, sister. And all those gorgeous noir shadows.",StephenKing
3708,2016-08-26 00:29:49+00:00,12690,2758,768968656764141568,"Molly, aka the Thing of Evil, prepares to eat the entire State of Maine. This takes villainy to a new level. https://t.co/sdahOZiizM",StephenKing
3709,2016-08-24 21:34:02+00:00,1906,361,768562030936743936,"THE UNDERGROUND RAILROAD, by Colson Whitehead: Terrific novel of escape, sacrifice, and redemption. Reminded me a bit of Larry McMurtry.",StephenKing
3710,2016-08-24 21:17:05+00:00,5168,1897,768557766231425024,"The most basic fact about Donald Trump: If brains were black powder, the guy couldn't blow his nose.",StephenKing
3711,2016-08-23 22:22:47+00:00,14073,5794,768211911322329088,"I'm excited for the IT move. Because we all float down here, Georgie. And you'll float, too. Want a balloon?",StephenKing
3712,2016-08-23 16:16:12+00:00,1567,187,768119659686133760,"Re THE GOOD WIFE: I like Alan Cumming (Eli). Always perfectly tailored, but always looking like a cat who just got sprayed with a hose.",StephenKing
3713,2016-08-22 00:34:34+00:00,2901,377,767520304004562944,"3 seasons into THE GOOD WIFE, it's clear to me that Lockhart-Gardner would go bankrupt without Kalinda Sharma. She's their magic lamp.",StephenKing
3714,2016-08-19 16:49:44+00:00,5125,1868,766678547092168704,Good cover story in TIME about the growing culture of hate on the internet. Helps to remember TROLL rhymes with ASSHOLE.,StephenKing
3715,2016-08-17 20:40:55+00:00,6725,1221,766011950195154944,I bought a new mouse. Guess I don't have to retire after all.,StephenKing
3716,2016-08-17 16:43:37+00:00,10020,3590,765952232391139328,"Gas prices? Down. Employment? Up. Inflation? Down. Stock market? Up.
THANKS, OBAMA!",StephenKing
3717,2016-08-15 16:35:35+00:00,11266,4303,765225436553109504,This is a sad day. I got strawberry jam in my computer mouse. Now I have to retire.,StephenKing
3718,2016-08-13 21:29:41+00:00,5245,1767,764574671002034176,I hate wen I misspiel on Twiyder.,StephenKing
3719,2016-08-13 15:47:14+00:00,1521,283,764488490482622464,"Brendan Dassex, supposedly Steven Avery's accomplice in the rape-murder of Teresa Haibach, has had his conviction overturned.",StephenKing
3720,2016-08-13 02:13:19+00:00,3380,567,764283662573723652,"SLADE HOUSE, by David Mitchell: Hard to imagine a more finely wrought and chilling tale of the supernatural. One of the rare great ones.",StephenKing
3721,2016-08-11 20:55:52+00:00,9707,4506,763841387318173700,"From the Book of Republicans: ""Lo, we have many assholes running for President. Let us consider, and pick the biggest. And so it was done.""",StephenKing
3722,2016-08-10 00:42:51+00:00,2143,251,763173732735123456,"It took 2 seasons, but Alicia and Will finally got together. Is that a spoiler? Who cares!  It happened 5 years ago.",StephenKing
3723,2016-08-09 21:30:05+00:00,8573,3067,763125221880688641,Wait a minute. Just reading down my Twitter feed. Trump said WHAT???,StephenKing
3724,2016-08-09 21:28:49+00:00,2265,285,763124900760551429,"Watching THE GOOD WIFE from the beginning. Into Season 2. God, is it smart. All the women have this Mona Lisa thing going.",StephenKing
3725,2016-08-09 15:41:23+00:00,1762,504,763037467800985600,50 GOP brainiacs wash their hands of Trump; Drudge Report ignores it.,StephenKing
3726,2016-08-09 15:39:37+00:00,1804,448,763037022579728408,"Sen. Susan Collins says she won't vote for Trump. Drudge Report ignores it, but posts old pic of HRC being helped up a flight of stairs.",StephenKing
3727,2016-08-08 15:28:25+00:00,6048,1307,762671815525330945,"Molly, aka the Thing of Evil, takes a break from writing her 1st book, THE DOGSHIT CHRONICLES. A sure beast-seller. https://t.co/MdUl87J2MQ",StephenKing
3728,2016-08-07 18:11:23+00:00,73,8,762350440847638528,"@SarahPinborough Are you sure that's not a urine sample, mate?",StephenKing
3729,2016-08-07 01:15:59+00:00,1562,121,762094905003040768,"Double feature at my house. CHARLEY VARRICK, followed by MR. MAJESTYK. With a Popeye cartoon.",StephenKing
3730,2016-08-05 23:27:05+00:00,4586,880,761705115439009792,"If you want to cool off this summer with a fine horror novel, hunt up THE DEEP, by Nick Cutter. Scary as hell, and well written, to boot.",StephenKing
3731,2016-08-05 23:26:05+00:00,5396,1146,761704863382265857,"Could we agree, at this point in the technology, that the phrase ""flatscreen TV"" has become redundant?",StephenKing
3732,2016-08-05 02:04:47+00:00,1369,254,761382413301903361,"I love TYRANT. If you're not watching, kick your VOD in gear, and start at Season 1.",StephenKing
3733,2016-08-03 00:10:33+00:00,8579,2009,760628889743949825,"Molly, aka the Thing of Evil, and her Uncle McMurtry enact a play called THIS YEAR'S ELECTION. https://t.co/lJsAWPPuEN",StephenKing
3734,2016-08-02 21:46:59+00:00,3384,659,760592759791181824,"Another line I could do without hearing: ""Could we have the room?"" Or, ""Walk with me."" People rarely say that shit in real life.",StephenKing
3735,2016-08-02 21:46:00+00:00,3728,712,760592509600948224,"One line I thankfully didn't have to listen to in STRANGER THINGS: ""Excuse me a minute, I have to take this.""",StephenKing
3736,2016-07-29 02:35:21+00:00,182,18,758853388914216960,@KimFCoates That looks so nasty. Gimme some.,StephenKing
3737,2016-07-29 02:34:44+00:00,1382,166,758853235708862464,"I enjoyed Peter Carey's wonderful novel, AMNESIA--not least of all because it brought back memories of playing Zork.",StephenKing
3738,2016-07-27 18:52:09+00:00,9433,3872,758374434432491520,"Don't vote for Trump, even if you like him, if he won't release his tax returns. Can't be President w/o disclosure.",StephenKing
3739,2016-07-27 18:23:51+00:00,96,13,758367313036996608,@RichardDooling Not to mention the friendly law enforcement.,StephenKing
3740,2016-07-27 16:22:29+00:00,6493,2554,758336769922301952,"Bill O'Reilly wants you to know that the slaves who built the White House were well-fed. Thanks for sharing, Bill.",StephenKing
3741,2016-07-27 16:10:40+00:00,7311,1173,758333793778409472,"Molly, aka the Thing of Evil, discusses new forms of bad behavior with her Uncle McMurtry, Joe Hill's dog. https://t.co/08KVX50NHV",StephenKing
3742,2016-07-27 16:09:27+00:00,2484,1000,758333487640371201,"Excerpt from ""Guns"" in the International Business Times. The  gun people don't like it, so I thought I'd post. :-) 
https://t.co/prhPDu7luj",StephenKing
3743,2016-07-27 15:54:35+00:00,6093,2177,758329749253025796,"News for fundamentalist Christians: If Jesus were around today, he'd turn Trump out with the rest of the money-changers.",StephenKing
3744,2016-07-26 16:33:01+00:00,4981,1921,757977033418866688,NY Times report Trump's duds are made in China.  Guess MAKE AMERICA GREAT AGAIN doesn't apply to the clothing industry.,StephenKing
3745,2016-07-25 15:45:09+00:00,863,216,757602598832799744,"A song of great social comment.
https://t.co/qLvg4cWTyQ",StephenKing
3746,2016-07-22 21:55:47+00:00,3032,740,756608706670919680,Pokemon GO: Brady Hartsfield would love it.,StephenKing
3747,2016-07-22 19:34:23+00:00,1168,205,756573123764510720,"Ridley Pearson's new thriller, WHITE BONE, is in stores now. Perfect for summer. You couldn't do better.",StephenKing
3748,2016-07-22 02:09:05+00:00,15679,7236,756310064064032770,"That wasn't a convention. It was something closer to a lynch mob. Republicans, you should hang your heads in shame.",StephenKing
3749,2016-07-21 01:20:33+00:00,16281,9145,755935463907680256,"One difference between Nixon and Trump: when the Republicans nominated Nixon, they didn't actually KNOW he was a crook.",StephenKing
3750,2016-07-20 20:27:09+00:00,5640,1681,755861625593364481,STRANGER THINGS: Is it possible the Evil Man With the White Hair isn't dead? Stay tuned.,StephenKing
3751,2016-07-19 23:30:04+00:00,793,91,755545269551427584,"Simon &amp; Schuster booth! Noon! Y'might even get it SIGNED by Ms. Evans! As Trump says, ""Who the hell knows?""",StephenKing
3752,2016-07-19 23:28:52+00:00,6490,1240,755544967066611712,"Hey, kids! Got my copy of CHARLIE THE CHOO-CHOO by Beyl Evans, straight from Mid-World! Get yours! #SDCC, Friday! https://t.co/hRw82rcnDe",StephenKing
3753,2016-07-19 16:21:37+00:00,3249,800,755437447471828993,"Speaking of the GOP convention, I wish I had the Ex-Lax concession. Never seen so many tight asses. I could retire.",StephenKing
3754,2016-07-19 16:20:08+00:00,6277,2206,755437074585714688,"Melanie Trump's speech was plagiarized? THANKS, OBAMA!",StephenKing
3755,2016-07-18 21:14:51+00:00,6218,2738,755148853473579008,The deal at the Republican convention appears to be this: Glass bottles prohibited; guns are OK. Welcome to the asylum.,StephenKing
3756,2016-07-18 02:28:34+00:00,15898,7531,754865415587758080,STRANGER THINGS is pure fun. A+. Don't miss it. Winona Ryder shines.,StephenKing
3757,2016-07-17 21:25:32+00:00,779,179,754789154983178241,"@pattonoswalt Well said. NY TImes reports a general saying ""Americans are in denial about their gun culture.""",StephenKing
3758,2016-07-17 15:30:08+00:00,190,21,754699714625466368,"@joe_hill As the recurring judge character on THE GOOD WIFE makes attorneys say, ""In my opinion.""",StephenKing
3759,2016-07-17 15:29:00+00:00,13782,6069,754699429047836672,Watching STRANGER THINGS is looking watching Steve King's Greatest Hits. I mean that in a good way.,StephenKing
3760,2016-07-17 01:48:32+00:00,2418,535,754492952521605120,"Emmy Awards to major network TV: As a serious artistic or cultural force, you are dead to us.",StephenKing
3761,2016-07-15 21:20:47+00:00,105,21,754063185322315777,"@KristenGBaldwin @BacheloretteABC Holy moly, lookit that hair. Turn him upside down and slide him like a hockey puck!",StephenKing
3762,2016-07-15 21:19:20+00:00,4830,955,754062817473531905,"I understand the presidential campaign is important, but my God, it's so long until November.",StephenKing
3763,2016-07-15 02:20:28+00:00,7726,3537,753776214402269184,"Whoever kills the innocent, kills his own family.",StephenKing
3764,2016-07-14 18:44:04+00:00,7709,3195,753661357136998400,Presidential election: Woman who can do the job now tied with an idiot who can't find his own ass with both hands and a flashlight. Wow.,StephenKing
3765,2016-07-13 10:42:24+00:00,3495,558,753177755521540096,"A truly terrifying pop music image: ""Talk about your childhood wishes/You can even eat the dishes."" I woke up with this in my head. Awful.",StephenKing
3766,2016-07-11 23:22:11+00:00,6362,1581,752644182251044864,My only question about the Netflix series STRANGER THINGS is whether or not it will be popular enough to crash their servers. It  might be.,StephenKing
3767,2016-07-08 22:10:50+00:00,2768,681,751539062784352257,Is it any wonder that most police support limited gun control?,StephenKing
3768,2016-07-08 22:10:06+00:00,3434,540,751538878553686016,Belated but heartfelt condolences to the families of those Dallas police officers killed in the line of duty.,StephenKing
3769,2016-07-08 19:07:13+00:00,830,123,751492853751222272,It's so great to have TYRANT back.,StephenKing
3770,2016-07-08 16:54:23+00:00,8134,1427,751459426901618688,"Molly, aka the Thing of Evil, freed from jail. Certain feline witnesses disappeared. Molly says ""I know nothing."" https://t.co/IIpIOGXLsL",StephenKing
3771,2016-07-07 21:10:52+00:00,2406,462,751161586660892672,"I'm loving BrainDead. This is extremely rich political satire, of both sides, and a rather moving plea for a little bipartisanship.",StephenKing
3772,2016-07-06 16:01:08+00:00,3752,1082,750721252520824832,"FBI to Clinton: You're careless.
American voters to Crazy Uncle Don: You're clueless.",StephenKing
3773,2016-07-03 00:47:17+00:00,2081,304,749404109602709504,...and she believed it was the purr-fect crime. #freemolly,StephenKing
3774,2016-07-03 00:30:55+00:00,10113,1888,749399990347374592,"Molly, aka the Thing of Evil, finally went too far. Jailed for stealing cat food. Third offense. No parole. https://t.co/MWBO4FIZFB",StephenKing
3775,2016-06-27 11:21:04+00:00,12361,4854,747389278204858368,"After Brexit, maybe Britain should go all the way and rename itself Boaty McBoatface.",StephenKing
3776,2016-06-26 11:00:31+00:00,2375,539,747021717126680576,HBO's THE NIGHT OF is brilliant entertainment. Great acting and a great story by Richard Price. You should get on board for this one.,StephenKing
3777,2016-06-24 19:34:27+00:00,6307,2361,746426279113588738,"Donald Trump has changed his mind, says he's going to run for British PM instead.",StephenKing
3778,2016-06-24 17:31:13+00:00,3163,982,746395264269811713,"Take it back, you guys, take it back, TAKE IT BACK.",StephenKing
3779,2016-06-24 17:28:33+00:00,3745,1324,746394596406607872,"Exit polling said Britain would stay in the EU. A year from now, you'll find few people who will own up to having voted to leave.",StephenKing
3780,2016-06-24 00:30:04+00:00,8446,1659,746138286016569345,"Molly, aka the Thing of Evil, rests contentedly beside the corpse of her latest toy. https://t.co/BawIbWlDU6",StephenKing
3781,2016-06-23 21:45:23+00:00,30907,23228,746096840324558848,"Gee, looks like NOBODY killed Freddie Gray. Guess he just died of being black. Funny how that happens in this country.",StephenKing
3782,2016-06-21 17:25:17+00:00,1369,297,745306611414147072,Paul Tremblay's uber-creepy follow-up to A HEAD FULL OF GHOSTS is published today: DISAPPEARANCE AT DEVIL'S ROCK. Don't miss this one.,StephenKing
3783,2016-06-21 11:17:32+00:00,20648,11819,745214061630136326,In America it is easier for a crazy person to get a gun than it is for a sick person to get pain medication. Screwed up priorities.,StephenKing
3784,2016-06-19 19:20:40+00:00,6836,2647,744610872203558912,"Terrible news about Anton Yelchin, crazily talented actor gone too soon.",StephenKing
3785,2016-06-19 03:08:34+00:00,1228,106,744366234158899200,Thanks to everyone who showed up today in Reno. Great tour for me. Thanks to all.,StephenKing
3786,2016-06-18 13:43:05+00:00,1473,160,744163528815239174,"Thanks to everyone who turned out last night here in beautiful Utah. We talked books, movies, and Jell-O.",StephenKing
